,question,answer,contexts,ground_truth,context_precision,faithfulness,answer_relevancy,context_recall
0,What has been the impact of Fábio Matias' interim role on the performance of the Botafogo team?,"Sob o comando de Fábio Matias, o Botafogo cresceu de produção e segue invicto, com seis vitórias e um empate em sete partidas. 50,8% dos torcedores votaram a favor da efetivação do treinador em uma enquete. O trabalho do interino trouxe mudanças importantes que ajudaram a reerguer o clube.","['No período, no entanto, o clube ainda vivia a transição do associativo para a SAF recém adquirida por Textor e já tinha acerto com Luís Castro. A direção esperou o português terminar o trabalho no Al Duhail, do Catar, e deixou Lúcio comandando a equipe.\n\nSob o comando de Fábio Matias, o Botafogo cresceu de produção e segue invicto. São seis vitórias e um empate em sete partidas. Em enquete promovida pelo ge, 50,8% dos torcedores votaram a favor da efetivação do treinador. Foram 2.055 votos computados.\n\nEnquete Fábio Matias — Foto: Reprodução\n\nLeia mais sobre o Botafogo:\n\nLeia mais sobre o Botafogo:\n\n+ Efetivar ou não? Os prós e contras de o Botafogo permanecer com Fábio Matias no comando; vote\n\n+ Matheus Nascimento no limbo: saiba como a joia de R$ 150 milhões virou terceira opção no Botafogo\n\nO trabalho do interino passa por algumas chances importantes que ajudaram a retomar o rumo e reerguer o clube no ano.\n\nFase artilheira de Júnior Santos'
 'Efetivar ou não? Os prós e contras de o Botafogo permanecer com Fábio Matias no comando; vote\n\nInterino vai completar um mês no cargo na próxima sexta-feira\n\nPor Redação do ge — Rio de Janeiro\n\n21/03/2024 05h02    Atualizado há 5 dias\n\nA pausa para a Data Fifa é também um período de decisões para o Botafogo, mas fora de campo. A direção do clube usa os dias sem jogos para definir quem será o novo treinador e também o novo diretor de futebol, após a saída de Tiago Nunes e André Mazzuco, respectivamente.\n\n+ ✅Clique aqui para seguir o novo canal ge Botafogo no WhatsApp\n\nge Botafogo analisa planejamento do clube para diretor e treinador\n\nO técnico foi demitido no último dia 22 de fevereiro e o auxiliar técnico Fábio Matias passou a ocupar o lugar de forma interina. A ideia da direção, manifestada inclusive em entrevistas por diferentes dirigentes, é trazer um profissional de fora para comandar a equipe.'
 'Contra o Sampaio Corrêa, no último domingo, Matias completou 50 partidas de futebol profissional, mas sempre em períodos temporários como interino ou disputando competições profissionais com times de base.\n\nExemplo com Lúcio Flávio\n\nA última experiência do Botafogo em efetivar um treinador interino não foi nada positiva: no ano passado, Lúcio Flávio ficou no cargo após duas vitórias no Brasileirão, mas o time caiu de rendimento e perdeu a liderança.\n\nHá uma natural desconfiança da torcida por causa disso, apesar dos contextos diferentes entre Fábio Matias e Lúcio Flávio no clube. De qualquer forma, o Alvinegro trata a questão com cautela porque considera o paulista um comandante com potencial e não quer ""queimá-lo"".\n\nComissão técnica\n\nO modelo de trabalho do Botafogo desde a contratação de Luís Castro, em 2022, é que o treinador que chega traga profissionais para a comissão técnica. Parte do sucesso do português se explica também pelos auxiliares que o cercavam.'
 'O que eu acho que bateu um pouquinho foi essa transição dele, sendo muito novo, e pegando o time do Botafogo muito irregular, caindo para a segunda divisão, com muito problema financeiro e sem elenco. Eu acho que o que atrasou ele foi isso, ele subiu em um grupo que não ajudou - afirmou Moacyr Fassbender, treinador do projeto Trops, que descobriu Matheus em Niterói.\n\nRecém-chegado ao profissional, Matheus encarava uma pressão incomum para um jovem de 16 anos. Esperava-se que ele fosse a solução para um time em dificuldades e salvasse o clube fora de campo, com uma venda que ajudaria a resolver os problemas financeiros. Até o momento, nada disso se concretizou.']","Under the interim role of Fábio Matias, the Botafogo team has seen an improvement in performance. They have achieved six victories and one draw in seven matches, and the team remains undefeated. Matias has made important changes, such as positioning Junior Santos as a forward, which has resulted in a goal-scoring spree for the player. Additionally, the team has received important reinforcements during this period, including Gregore and Damián Suárez.",0.9999999999666667,1.0,0.889026086667091,0.75
1,What were the pressures and expectations placed on Matheus Nascimento when he joined the professional team at Botafogo?,"Matheus Nascimento enfrentou pressões incomuns ao subir para o time profissional do Botafogo, sendo esperado que ele salvasse o clube em dificuldades financeiras e em campo. Ele entrou em um grupo que não o ajudou a se desenvolver, resultando em poucas oportunidades de jogo. Apesar de seu potencial, a má gestão a longo prazo afetou sua progressão no clube.","['O que eu acho que bateu um pouquinho foi essa transição dele, sendo muito novo, e pegando o time do Botafogo muito irregular, caindo para a segunda divisão, com muito problema financeiro e sem elenco. Eu acho que o que atrasou ele foi isso, ele subiu em um grupo que não ajudou - afirmou Moacyr Fassbender, treinador do projeto Trops, que descobriu Matheus em Niterói.\n\nRecém-chegado ao profissional, Matheus encarava uma pressão incomum para um jovem de 16 anos. Esperava-se que ele fosse a solução para um time em dificuldades e salvasse o clube fora de campo, com uma venda que ajudaria a resolver os problemas financeiros. Até o momento, nada disso se concretizou.'
 'Matheus Nascimento comemora título pelo Trops — Foto: Divulgação\n\nEle entrou e ficou claro que era muito diferente. Na época a gente fez um torneio logo que ele entrou da categoria sub-9, só que a gente botou dois times, um de 9 anos e um de 8, ele tinha 8. Quando ele começou, era notável, fez muita diferença. Tanto que o time sub-8 teve um desempenho melhor que o 9 - afirmou Moacyr Fassbender.\n\nDa infância até a adolescência no Botafogo, dois pontos foram comuns na carreira do jogador Matheus Nascimento: jogar na categoria acima da faixa de idade que tinha e ser convocado para a seleção brasileira.\n\nMatheus Nascimento no time de base do Botafogo — Foto: Giba Perez/Divulgação\n\nCom a camisa verde e amarela, foi campeão Sul-Americano sub-15 como centroavante titular. Chegou a ser convocado para o continental também com o sub-17, mas o torneio foi cancelado.'
 'Veja os gols de Matheus Nascimento pelo Botafogo\n\nCom mais de 150 gols na base, Matheus Nascimento assinou seu primeiro contrato profissional com o Botafogo em março de 2020, dias depois de completar 16 anos. Recentemente, o vínculo foi renovado até 2025 por John Textor, com direito a aumento salarial.\n\nQuase quatro anos depois daquele primeiro contrato profissional, ele é a terceira opção de centroavante. À sua frente, por exemplo, está Janderson, que não fez categorias de base, enquanto Matheus era convocado para as seleções.\n\n+ Grupo do Botafogo na Libertadores 2024: conheça os times\n\nMatheus Nascimento assina contrato com o Botafogo — Foto: Divulgação\n\nAo longo do Carioca de 2024, sempre que Tiago Nunes e Fábio Matias optaram por entrar com uma equipe reserva, o camisa 90 começou no banco da mesma forma.\n\nNo time principal do Botafogo, o jovem marcou até agora 11 gols em 88 jogos. Reserva na maior parte das vezes, ele tem média de 42,7 minutos por partida.'
 'É um jogador que tem muita qualidade técnica, potencial incrível, mas é consequência de um processo mal gerido a longo prazo. Um menino que sobe com 16 anos e não consegue ter continuidade de jogos, fica em um limbo, não tem números suficiente de partidas para se desenvolver - disse Tiago Nunes no início deste ano antes de ser demitido.\n\nNo time principal do Botafogo, o jovem marcou até agora 11 gols em 88 jogos. Reserva na maior parte das vezes, ele tem média de 42,7 minutos por partida.\n\nAos poucos, o atacante vem perdendo mais espaço no elenco. No jogo decisivo contra o Bragantino, pela Libertadores, ficou fora até da lista de relacionados. Seu lugar foi ocupado por Yarlen, de 18 anos. Matheus chegou a fazer uma postagem nas redes sociais em tom de indireta após a divulgação da lista.\n\nMatheus Nascimento no Instagram após ficar fora dos relacionados — Foto: Reprodução\n\nAscensão ao profissional']","Matheus Nascimento faced the pressure of trying to avoid relegation and establish himself among more experienced players. There were expectations for him to save the club financially through a potential sale. However, none of these pressures and expectations have been fulfilled.",0.9999999999,1.0,0.9280314434745985,1.0
2,What factors have contributed to the mismanagement of Matheus Nascimento's career?,A transição para o profissional em um momento de crise financeira e instabilidade no clube contribuíram para a má gestão da carreira de Matheus Nascimento. A falta de sequência de jogos e a pressão para ser a solução do time em dificuldades também impactaram negativamente seu desenvolvimento. A ascensão apressada e a falta de oportunidades adequadas para um jovem em processo de maturação também foram fatores que prejudicaram sua carreira.,"['O que eu acho que bateu um pouquinho foi essa transição dele, sendo muito novo, e pegando o time do Botafogo muito irregular, caindo para a segunda divisão, com muito problema financeiro e sem elenco. Eu acho que o que atrasou ele foi isso, ele subiu em um grupo que não ajudou - afirmou Moacyr Fassbender, treinador do projeto Trops, que descobriu Matheus em Niterói.\n\nRecém-chegado ao profissional, Matheus encarava uma pressão incomum para um jovem de 16 anos. Esperava-se que ele fosse a solução para um time em dificuldades e salvasse o clube fora de campo, com uma venda que ajudaria a resolver os problemas financeiros. Até o momento, nada disso se concretizou.'
 'É um jogador que tem muita qualidade técnica, potencial incrível, mas é consequência de um processo mal gerido a longo prazo. Um menino que sobe com 16 anos e não consegue ter continuidade de jogos, fica em um limbo, não tem números suficiente de partidas para se desenvolver - disse Tiago Nunes no início deste ano antes de ser demitido.\n\nNo time principal do Botafogo, o jovem marcou até agora 11 gols em 88 jogos. Reserva na maior parte das vezes, ele tem média de 42,7 minutos por partida.\n\nAos poucos, o atacante vem perdendo mais espaço no elenco. No jogo decisivo contra o Bragantino, pela Libertadores, ficou fora até da lista de relacionados. Seu lugar foi ocupado por Yarlen, de 18 anos. Matheus chegou a fazer uma postagem nas redes sociais em tom de indireta após a divulgação da lista.\n\nMatheus Nascimento no Instagram após ficar fora dos relacionados — Foto: Reprodução\n\nAscensão ao profissional'
 'Apesar de ser convocado constantemente para a seleção olímpica, acabou ficando fora do torneio pré-olímpico, disputado na Venezuela, depois de ver alguns jogadores furarem a fila por terem mais tempo em campo em 2023.\n\nCom a ascensão apressada aos profissionais, Matheus Nascimento nunca disputou uma Copa São Paulo de Futebol Júnior, por exemplo. A principal competição de base do Brasil recebe jogadores de até 21 anos e o atacante poderia disputá-la em 2025.\n\nMatheus Nascimento comemora gol da seleção brasileira sub-15 — Foto: Rener Pinheiro / MoWA Press\n\nDesde que chegou ao time principal, Matheus teve pouca sequência de partidas, o que seria essencial para o desenvolvimento de um jovem em processo de maturação.\n\nOs quatro anos de profissional parecem uma eternidade para quem acompanha a carreira de Matheus Nascimento de perto. Porém, aos 20 anos, o jovem atacante ainda está no princípio. O futuro depende do que ele fará com as próximas oportunidades, dentro ou fora do Botafogo.'
 'Ascensão ao profissional\n\nO Matheus é um grande potencial do clube, a gente não pode esquecer disso. Mas temos que dar tempo ao tempo para que ele consiga se organizar da melhor maneira possível e ter uma melhora significativa no desempenho. É um ótimo jogador, tem muita qualidade - afirmou Fábio Matias, que assumiu como técnico interino.\n\nAscensão ao profissional\n\nMatheus Nascimento chegou ao elenco profissional em momento conturbado da história do clube. Em crise financeira, o Glorioso tinha dificuldades para montar o elenco no meio de 2020, após o início da pandemia da Covid-19, e apostou na promessa.\n\nFoi nesse contexto que o garoto de 16 anos tentou se firmar no elenco profissional, com a pressão de tentar evitar o rebaixamento e buscar a consolidação entre atletas mais experientes. Naquele mesmo ano, o Alvinegro caiu para a Série B ao terminar o Brasileirão na lanterna.']","The mismanagement of Matheus Nascimento's career can be attributed to factors such as his inability to have a consistent run of games, being in a state of limbo due to not having enough game time to develop, and being behind other players in the pecking order despite his technical quality and potential.",0.999999999975,1.0,0.9297036412914337,1.0
3,What challenges did Matheus Nascimento face when he was promoted to the professional team of Botafogo?,"Matheus Nascimento enfrentou a pressão de ser visto como a solução para um time em dificuldades financeiras e esportivas. Ele entrou no elenco profissional em um momento conturbado, com o Botafogo lutando contra o rebaixamento. A falta de sequência de jogos também foi um desafio para o seu desenvolvimento.","['O que eu acho que bateu um pouquinho foi essa transição dele, sendo muito novo, e pegando o time do Botafogo muito irregular, caindo para a segunda divisão, com muito problema financeiro e sem elenco. Eu acho que o que atrasou ele foi isso, ele subiu em um grupo que não ajudou - afirmou Moacyr Fassbender, treinador do projeto Trops, que descobriu Matheus em Niterói.\n\nRecém-chegado ao profissional, Matheus encarava uma pressão incomum para um jovem de 16 anos. Esperava-se que ele fosse a solução para um time em dificuldades e salvasse o clube fora de campo, com uma venda que ajudaria a resolver os problemas financeiros. Até o momento, nada disso se concretizou.'
 'Matheus Nascimento comemora título pelo Trops — Foto: Divulgação\n\nEle entrou e ficou claro que era muito diferente. Na época a gente fez um torneio logo que ele entrou da categoria sub-9, só que a gente botou dois times, um de 9 anos e um de 8, ele tinha 8. Quando ele começou, era notável, fez muita diferença. Tanto que o time sub-8 teve um desempenho melhor que o 9 - afirmou Moacyr Fassbender.\n\nDa infância até a adolescência no Botafogo, dois pontos foram comuns na carreira do jogador Matheus Nascimento: jogar na categoria acima da faixa de idade que tinha e ser convocado para a seleção brasileira.\n\nMatheus Nascimento no time de base do Botafogo — Foto: Giba Perez/Divulgação\n\nCom a camisa verde e amarela, foi campeão Sul-Americano sub-15 como centroavante titular. Chegou a ser convocado para o continental também com o sub-17, mas o torneio foi cancelado.'
 'Ascensão ao profissional\n\nO Matheus é um grande potencial do clube, a gente não pode esquecer disso. Mas temos que dar tempo ao tempo para que ele consiga se organizar da melhor maneira possível e ter uma melhora significativa no desempenho. É um ótimo jogador, tem muita qualidade - afirmou Fábio Matias, que assumiu como técnico interino.\n\nAscensão ao profissional\n\nMatheus Nascimento chegou ao elenco profissional em momento conturbado da história do clube. Em crise financeira, o Glorioso tinha dificuldades para montar o elenco no meio de 2020, após o início da pandemia da Covid-19, e apostou na promessa.\n\nFoi nesse contexto que o garoto de 16 anos tentou se firmar no elenco profissional, com a pressão de tentar evitar o rebaixamento e buscar a consolidação entre atletas mais experientes. Naquele mesmo ano, o Alvinegro caiu para a Série B ao terminar o Brasileirão na lanterna.'
 'Apesar de ser convocado constantemente para a seleção olímpica, acabou ficando fora do torneio pré-olímpico, disputado na Venezuela, depois de ver alguns jogadores furarem a fila por terem mais tempo em campo em 2023.\n\nCom a ascensão apressada aos profissionais, Matheus Nascimento nunca disputou uma Copa São Paulo de Futebol Júnior, por exemplo. A principal competição de base do Brasil recebe jogadores de até 21 anos e o atacante poderia disputá-la em 2025.\n\nMatheus Nascimento comemora gol da seleção brasileira sub-15 — Foto: Rener Pinheiro / MoWA Press\n\nDesde que chegou ao time principal, Matheus teve pouca sequência de partidas, o que seria essencial para o desenvolvimento de um jovem em processo de maturação.\n\nOs quatro anos de profissional parecem uma eternidade para quem acompanha a carreira de Matheus Nascimento de perto. Porém, aos 20 anos, o jovem atacante ainda está no princípio. O futuro depende do que ele fará com as próximas oportunidades, dentro ou fora do Botafogo.']","Matheus Nascimento faced challenges such as joining the professional team during a financial crisis, trying to avoid relegation, playing with more experienced players, and dealing with the pressure to save the club from its financial problems. However, he has not been able to fulfill these expectations so far.",0.999999999975,1.0,0.9068182006687122,1.0
4,What are the arguments in favor and against the permanent appointment of Fábio Matias as the coach of Botafogo?,"A favor da efetivação de Fábio Matias como treinador do Botafogo estão o conhecimento do elenco, a boa fase da equipe sob seu comando e o custo-benefício de manter um técnico com salário mais baixo. Contra a efetivação, há a falta de experiência de Matias no futebol profissional.","['Efetivar ou não? Os prós e contras de o Botafogo permanecer com Fábio Matias no comando; vote\n\nInterino vai completar um mês no cargo na próxima sexta-feira\n\nPor Redação do ge — Rio de Janeiro\n\n21/03/2024 05h02    Atualizado há 5 dias\n\nA pausa para a Data Fifa é também um período de decisões para o Botafogo, mas fora de campo. A direção do clube usa os dias sem jogos para definir quem será o novo treinador e também o novo diretor de futebol, após a saída de Tiago Nunes e André Mazzuco, respectivamente.\n\n+ ✅Clique aqui para seguir o novo canal ge Botafogo no WhatsApp\n\nge Botafogo analisa planejamento do clube para diretor e treinador\n\nO técnico foi demitido no último dia 22 de fevereiro e o auxiliar técnico Fábio Matias passou a ocupar o lugar de forma interina. A ideia da direção, manifestada inclusive em entrevistas por diferentes dirigentes, é trazer um profissional de fora para comandar a equipe.'
 'Porém, o elenco vem dando respostas dentro de campo desde que o gaúcho assumiu a liderança do vestiário. Com ele na beira do campo, são sete partidas com seis vitórias e um empate, sendo esse último que garantiu uma vaga na fase de grupos da Libertadores fora de casa com um jogador a menos.\n\nEm meio ao debate se Matias deve ou não ser efetivado no comando da equipe, o ge reuniu três argumentos pela permanência, e três contra e pede o seu voto sobre o tema. Confira:\n\nConhecimento do elenco\n\nFábio Matias chegou ao clube em janeiro. Por mais que não seja um período tão extenso de trabalho no Glorioso, ele já participou de toda a pré-temporada com o grupo, fez observações e conhece bem os jogadores que tem à disposição.\n\nO profissional que vier de fora, ainda que seja de um time do Brasil, terá que passar por esse processo de conhecer os jogadores em meio a partidas decisivas de Libertadores, Copa do Brasil e Brasileiro nos próximos meses.\n\nBoa fase'
 'No período, no entanto, o clube ainda vivia a transição do associativo para a SAF recém adquirida por Textor e já tinha acerto com Luís Castro. A direção esperou o português terminar o trabalho no Al Duhail, do Catar, e deixou Lúcio comandando a equipe.\n\nSob o comando de Fábio Matias, o Botafogo cresceu de produção e segue invicto. São seis vitórias e um empate em sete partidas. Em enquete promovida pelo ge, 50,8% dos torcedores votaram a favor da efetivação do treinador. Foram 2.055 votos computados.\n\nEnquete Fábio Matias — Foto: Reprodução\n\nLeia mais sobre o Botafogo:\n\nLeia mais sobre o Botafogo:\n\n+ Efetivar ou não? Os prós e contras de o Botafogo permanecer com Fábio Matias no comando; vote\n\n+ Matheus Nascimento no limbo: saiba como a joia de R$ 150 milhões virou terceira opção no Botafogo\n\nO trabalho do interino passa por algumas chances importantes que ajudaram a retomar o rumo e reerguer o clube no ano.\n\nFase artilheira de Júnior Santos'
 'Custo-benefício\n\nA promoção de auxiliar técnico para treinador principal certamente implicaria em um aumento salarial para Fábio, mas nem de perto colocaria ele entre os treinadores mais caros do país, já que será o primeiro trabalho efetivo à nível profissional.\n\nAo ter um técnico com salário mais baixo, o Glorioso poderia usar o dinheiro que gastaria em outras frentes para qualificar a estrutura.\n\nGiba Perez analisa calendário do Botafogo com Libertadores e Copa do Brasil\n\nE aí, torcedor? Vote na enquete abaixo! 👇\n\nFábio Matias deve ser efetivado como treinador do Botafogo?\n\nVOTE AQUI\n\nFalta de experiência no profissional\n\nO treinador de apenas 44 anos tem mais de duas décadas trabalhando no futebol e muitos anos como técnico em divisões de base. No entanto, ele nunca treinou um time profissional na carreira.']","The arguments in favor of the permanent appointment of Fábio Matias as the coach of Botafogo are: 1) He has knowledge of the team and the players as he has been with the club since January and has participated in the preseason with the group. 2) He has achieved good results on the field, with six victories and one draw in seven matches as the coach. 3) The promotion of an assistant coach to the position of head coach would be cost-effective. The arguments against the permanent appointment of Fábio Matias as the coach of Botafogo are not mentioned in the context.",0.49999999995,1.0,0.911433848001726,0.75
5,What hindered Matheus Nascimento's progress in Botafogo?,"Matheus Nascimento's progress in Botafogo was hindered by the pressure of being expected to save the struggling team at a young age and the financial problems the club faced. Additionally, his frequent absences due to national team call-ups also impacted his development within the team. Despite his technical quality and potential, a poorly managed long-term process prevented him from getting enough playing time to fully develop.","['O que eu acho que bateu um pouquinho foi essa transição dele, sendo muito novo, e pegando o time do Botafogo muito irregular, caindo para a segunda divisão, com muito problema financeiro e sem elenco. Eu acho que o que atrasou ele foi isso, ele subiu em um grupo que não ajudou - afirmou Moacyr Fassbender, treinador do projeto Trops, que descobriu Matheus em Niterói.\n\nRecém-chegado ao profissional, Matheus encarava uma pressão incomum para um jovem de 16 anos. Esperava-se que ele fosse a solução para um time em dificuldades e salvasse o clube fora de campo, com uma venda que ajudaria a resolver os problemas financeiros. Até o momento, nada disso se concretizou.'
 'Matheus Nascimento comemora título pelo Trops — Foto: Divulgação\n\nEle entrou e ficou claro que era muito diferente. Na época a gente fez um torneio logo que ele entrou da categoria sub-9, só que a gente botou dois times, um de 9 anos e um de 8, ele tinha 8. Quando ele começou, era notável, fez muita diferença. Tanto que o time sub-8 teve um desempenho melhor que o 9 - afirmou Moacyr Fassbender.\n\nDa infância até a adolescência no Botafogo, dois pontos foram comuns na carreira do jogador Matheus Nascimento: jogar na categoria acima da faixa de idade que tinha e ser convocado para a seleção brasileira.\n\nMatheus Nascimento no time de base do Botafogo — Foto: Giba Perez/Divulgação\n\nCom a camisa verde e amarela, foi campeão Sul-Americano sub-15 como centroavante titular. Chegou a ser convocado para o continental também com o sub-17, mas o torneio foi cancelado.'
 'É um jogador que tem muita qualidade técnica, potencial incrível, mas é consequência de um processo mal gerido a longo prazo. Um menino que sobe com 16 anos e não consegue ter continuidade de jogos, fica em um limbo, não tem números suficiente de partidas para se desenvolver - disse Tiago Nunes no início deste ano antes de ser demitido.\n\nNo time principal do Botafogo, o jovem marcou até agora 11 gols em 88 jogos. Reserva na maior parte das vezes, ele tem média de 42,7 minutos por partida.\n\nAos poucos, o atacante vem perdendo mais espaço no elenco. No jogo decisivo contra o Bragantino, pela Libertadores, ficou fora até da lista de relacionados. Seu lugar foi ocupado por Yarlen, de 18 anos. Matheus chegou a fazer uma postagem nas redes sociais em tom de indireta após a divulgação da lista.\n\nMatheus Nascimento no Instagram após ficar fora dos relacionados — Foto: Reprodução\n\nAscensão ao profissional'
 '— Túlio Lustosa\n\nMatheus Nascimento é uma das esperanças do Botafogo para 2022\n\nO amadurecimento ao longo dos anos não se traduziu em mais tempo em campo. O período em que o atleta mais jogou foi em 2022, justamente quando o Botafogo reformulava o elenco que subiu da Série B com a chegada da SAF.\n\nDesde então, aos poucos, perdeu minutos e espaço. O ex-treinador alvinegro Lúcio Flávio acredita que as seguidas convocações para as seleções de base prejudicaram Matheus no Botafogo:\n\n+ ✅Clique aqui para seguir o novo canal ge Botafogo no WhatsApp\n\nEu credito muito a isso de ficar ausente em mais períodos. Quando retornava, já tinha um trabalho com aqueles que ali estavam. Por um lado, é sempre bom o jogador estar indo para uma seleção. Mas, por vezes, você acaba perdendo espaço, porque outros vão ocupar e dificilmente depois vai ser dado novamente.\n\n+ ✅Clique aqui para seguir o novo canal ge Botafogo no WhatsApp\n\nPersonalidade reservada']","Matheus Nascimento's progress in Botafogo was hindered by the team's financial crisis, irregular performance, relegation to the second division, and lack of support from the group. There was also excessive pressure on him to solve the club's technical and financial problems.",0.9999999999666667,1.0,0.9916953662581812,0.5
6,"What improvements have happened in Botafogo team's performance under Fábio Matias, considering their unbeaten record, Junior Santos' goal-scoring form, and the arrival of reinforcements?","Under Fábio Matias, Botafogo has seen improvements in their performance, with an unbeaten record of six wins and one draw in seven matches. Junior Santos has been crucial, scoring 12 goals in the season, with eight of them coming in the seven games under the new coach. The arrival of reinforcements like Gregore and Damián Suárez has also strengthened the team.","['Fase artilheira de Júnior Santos\n\nBotafogo 6 x 0 Aurora - Melhores momentos - CONMEBOL Libertadores 2024\n\nMuito dos bons resultados obtidos pelo time com o treinador se devem aos pés de Junior Santos. O atacante tem 12 gols na temporada, sendo oito deles no período de sete partidas da gestão do gaúcho.\n\nO bom aproveitamento do atacante se deve também a um ajuste de posição que Matias fez com o camisa 11, o deixando mais avançado para atacar o campo com a força e a velocidade que tem.\n\n+ Leia mais notícias do Botafogo\n\nFabio Matias em Botafogo x Aurora — Foto: Thiago Ribeiro/AGIF\n\nReforços chegando\n\nO Botafogo recebeu reforços importantes no período do interino. Gregore fez o primeiro jogo com a camisa alvinegra contra o Audax, a primeira partida do técnico. O lateral-direito Damián Suárez, titular do setor, estreou no jogo contra o Aurora.'
 'No período, no entanto, o clube ainda vivia a transição do associativo para a SAF recém adquirida por Textor e já tinha acerto com Luís Castro. A direção esperou o português terminar o trabalho no Al Duhail, do Catar, e deixou Lúcio comandando a equipe.\n\nSob o comando de Fábio Matias, o Botafogo cresceu de produção e segue invicto. São seis vitórias e um empate em sete partidas. Em enquete promovida pelo ge, 50,8% dos torcedores votaram a favor da efetivação do treinador. Foram 2.055 votos computados.\n\nEnquete Fábio Matias — Foto: Reprodução\n\nLeia mais sobre o Botafogo:\n\nLeia mais sobre o Botafogo:\n\n+ Efetivar ou não? Os prós e contras de o Botafogo permanecer com Fábio Matias no comando; vote\n\n+ Matheus Nascimento no limbo: saiba como a joia de R$ 150 milhões virou terceira opção no Botafogo\n\nO trabalho do interino passa por algumas chances importantes que ajudaram a retomar o rumo e reerguer o clube no ano.\n\nFase artilheira de Júnior Santos'
 'Especialmente o defensor foi peça crucial. O clube passou os primeiros meses do ano sem um jogador de ofício no setor, e Nunes precisou improvisar jogadores.\n\nDiscurso firme\n\nUma das principais mudanças desde que Fábio Matias passou a comandar a equipe é o discurso. Ele foi firme nas entrevistas e fez questão de deixar para trás o trauma de 2023 sempre que teve a oportunidade de falar.\n\nOs jogadores compraram o discurso e mudaram também o comportamento dentro de campo, jogando de forma mais agressiva.\n\nParceria com a arquibancada\n\nA luta em campo e os bons resultados ajudaram a resgatar a parceria entre time e arquibancada, rompida na reta final de 2023.\n\nCom dois gols de Júnior Santos, Botafogo vence o Bragantino'
 'Porém, o elenco vem dando respostas dentro de campo desde que o gaúcho assumiu a liderança do vestiário. Com ele na beira do campo, são sete partidas com seis vitórias e um empate, sendo esse último que garantiu uma vaga na fase de grupos da Libertadores fora de casa com um jogador a menos.\n\nEm meio ao debate se Matias deve ou não ser efetivado no comando da equipe, o ge reuniu três argumentos pela permanência, e três contra e pede o seu voto sobre o tema. Confira:\n\nConhecimento do elenco\n\nFábio Matias chegou ao clube em janeiro. Por mais que não seja um período tão extenso de trabalho no Glorioso, ele já participou de toda a pré-temporada com o grupo, fez observações e conhece bem os jogadores que tem à disposição.\n\nO profissional que vier de fora, ainda que seja de um time do Brasil, terá que passar por esse processo de conhecer os jogadores em meio a partidas decisivas de Libertadores, Copa do Brasil e Brasileiro nos próximos meses.\n\nBoa fase']","Under Fábio Matias, the Botafogo team has shown improvements in their performance. They have remained unbeaten with six victories and one draw in seven matches. Junior Santos has been in excellent goal-scoring form, with 12 goals in the season, eight of which were scored under Matias' management. Additionally, the team has received important reinforcements, such as Gregore and Damián Suárez, who have made significant contributions to the team.",0.999999999975,1.0,0.927202308273222,1.0
7,"What challenges did Matheus Nascimento face when joining Botafogo's professional team, and what were the expectations for his performance and financial stability?","Matheus Nascimento enfrentou desafios ao entrar no time profissional do Botafogo devido à pressão de ser jovem e ao contexto do clube em dificuldades financeiras. Esperava-se que ele fosse a solução para o time e ajudasse a resolver os problemas financeiros com uma possível venda. Até o momento, ele não conseguiu atender às expectativas de desempenho e estabilidade financeira.","['O que eu acho que bateu um pouquinho foi essa transição dele, sendo muito novo, e pegando o time do Botafogo muito irregular, caindo para a segunda divisão, com muito problema financeiro e sem elenco. Eu acho que o que atrasou ele foi isso, ele subiu em um grupo que não ajudou - afirmou Moacyr Fassbender, treinador do projeto Trops, que descobriu Matheus em Niterói.\n\nRecém-chegado ao profissional, Matheus encarava uma pressão incomum para um jovem de 16 anos. Esperava-se que ele fosse a solução para um time em dificuldades e salvasse o clube fora de campo, com uma venda que ajudaria a resolver os problemas financeiros. Até o momento, nada disso se concretizou.'
 'Matheus Nascimento comemora título pelo Trops — Foto: Divulgação\n\nEle entrou e ficou claro que era muito diferente. Na época a gente fez um torneio logo que ele entrou da categoria sub-9, só que a gente botou dois times, um de 9 anos e um de 8, ele tinha 8. Quando ele começou, era notável, fez muita diferença. Tanto que o time sub-8 teve um desempenho melhor que o 9 - afirmou Moacyr Fassbender.\n\nDa infância até a adolescência no Botafogo, dois pontos foram comuns na carreira do jogador Matheus Nascimento: jogar na categoria acima da faixa de idade que tinha e ser convocado para a seleção brasileira.\n\nMatheus Nascimento no time de base do Botafogo — Foto: Giba Perez/Divulgação\n\nCom a camisa verde e amarela, foi campeão Sul-Americano sub-15 como centroavante titular. Chegou a ser convocado para o continental também com o sub-17, mas o torneio foi cancelado.'
 'Matheus Nascimento no limbo: saiba como a joia de R$ 150 milhões virou terceira opção no Botafogo\n\nMaior promessa do clube neste século, atacante teve proposta do Braga de R$ 149 milhões recusada em 2021 pela diretoria alvinegra. Hoje, perde cada vez mais espaço no elenco\n\nPor Giba Perez — Rio de Janeiro\n\n20/03/2024 05h02    Atualizado há 6 dias\n\nA passagem de Matheus Nascimento pelas divisões de base do Botafogo se tornou uma espécie de lenda. No século 21, o clube nunca viu alguém parecido. Desde sua chegada, com 12 anos, em 2016, o atacante impressionou quem o acompanhou em todas as categorias alvinegras e na Seleção.\n\nNos profissionais, no entanto, a história é diferente. Pelo menos até agora. Aos 20 anos, o jogador não se transferiu para a Europa e até hoje luta para conquistar seu espaço no elenco alvinegro. Na fila dos centroavantes, está atrás de Tiquinho e Janderson. O que acontece com Matheus? O ge explica o momento da joia.\n\nVeja os gols de Matheus Nascimento pelo Botafogo'
 'Veja os gols de Matheus Nascimento pelo Botafogo\n\nCom mais de 150 gols na base, Matheus Nascimento assinou seu primeiro contrato profissional com o Botafogo em março de 2020, dias depois de completar 16 anos. Recentemente, o vínculo foi renovado até 2025 por John Textor, com direito a aumento salarial.\n\nQuase quatro anos depois daquele primeiro contrato profissional, ele é a terceira opção de centroavante. À sua frente, por exemplo, está Janderson, que não fez categorias de base, enquanto Matheus era convocado para as seleções.\n\n+ Grupo do Botafogo na Libertadores 2024: conheça os times\n\nMatheus Nascimento assina contrato com o Botafogo — Foto: Divulgação\n\nAo longo do Carioca de 2024, sempre que Tiago Nunes e Fábio Matias optaram por entrar com uma equipe reserva, o camisa 90 começou no banco da mesma forma.\n\nNo time principal do Botafogo, o jovem marcou até agora 11 gols em 88 jogos. Reserva na maior parte das vezes, ele tem média de 42,7 minutos por partida.']","Matheus Nascimento faced challenges such as joining the professional team during a financial crisis and trying to avoid relegation. There were expectations that he would help save the club financially through a potential sale. However, these expectations have not been met so far.",0.8333333332916666,1.0,0.965794216908626,1.0
8,"What has Fábio Matias' interim role done for the Botafogo team, considering their growth, undefeated record, and positive contributions of players like Júnior Santos and important reinforcements during his tenure?","O trabalho de Fábio Matias como interino do Botafogo resultou em um crescimento da equipe, que permanece invicta com seis vitórias e um empate em sete partidas. A fase artilheira de Júnior Santos e a contribuição positiva de jogadores importantes durante seu comando são aspectos destacados. A direção do clube está avaliando a possibilidade de efetivar Matias como treinador, considerando os prós e contras da decisão.","['No período, no entanto, o clube ainda vivia a transição do associativo para a SAF recém adquirida por Textor e já tinha acerto com Luís Castro. A direção esperou o português terminar o trabalho no Al Duhail, do Catar, e deixou Lúcio comandando a equipe.\n\nSob o comando de Fábio Matias, o Botafogo cresceu de produção e segue invicto. São seis vitórias e um empate em sete partidas. Em enquete promovida pelo ge, 50,8% dos torcedores votaram a favor da efetivação do treinador. Foram 2.055 votos computados.\n\nEnquete Fábio Matias — Foto: Reprodução\n\nLeia mais sobre o Botafogo:\n\nLeia mais sobre o Botafogo:\n\n+ Efetivar ou não? Os prós e contras de o Botafogo permanecer com Fábio Matias no comando; vote\n\n+ Matheus Nascimento no limbo: saiba como a joia de R$ 150 milhões virou terceira opção no Botafogo\n\nO trabalho do interino passa por algumas chances importantes que ajudaram a retomar o rumo e reerguer o clube no ano.\n\nFase artilheira de Júnior Santos'
 'Efetivar ou não? Os prós e contras de o Botafogo permanecer com Fábio Matias no comando; vote\n\nInterino vai completar um mês no cargo na próxima sexta-feira\n\nPor Redação do ge — Rio de Janeiro\n\n21/03/2024 05h02    Atualizado há 5 dias\n\nA pausa para a Data Fifa é também um período de decisões para o Botafogo, mas fora de campo. A direção do clube usa os dias sem jogos para definir quem será o novo treinador e também o novo diretor de futebol, após a saída de Tiago Nunes e André Mazzuco, respectivamente.\n\n+ ✅Clique aqui para seguir o novo canal ge Botafogo no WhatsApp\n\nge Botafogo analisa planejamento do clube para diretor e treinador\n\nO técnico foi demitido no último dia 22 de fevereiro e o auxiliar técnico Fábio Matias passou a ocupar o lugar de forma interina. A ideia da direção, manifestada inclusive em entrevistas por diferentes dirigentes, é trazer um profissional de fora para comandar a equipe.'
 'Contra o Sampaio Corrêa, no último domingo, Matias completou 50 partidas de futebol profissional, mas sempre em períodos temporários como interino ou disputando competições profissionais com times de base.\n\nExemplo com Lúcio Flávio\n\nA última experiência do Botafogo em efetivar um treinador interino não foi nada positiva: no ano passado, Lúcio Flávio ficou no cargo após duas vitórias no Brasileirão, mas o time caiu de rendimento e perdeu a liderança.\n\nHá uma natural desconfiança da torcida por causa disso, apesar dos contextos diferentes entre Fábio Matias e Lúcio Flávio no clube. De qualquer forma, o Alvinegro trata a questão com cautela porque considera o paulista um comandante com potencial e não quer ""queimá-lo"".\n\nComissão técnica\n\nO modelo de trabalho do Botafogo desde a contratação de Luís Castro, em 2022, é que o treinador que chega traga profissionais para a comissão técnica. Parte do sucesso do português se explica também pelos auxiliares que o cercavam.'
 'Porém, o elenco vem dando respostas dentro de campo desde que o gaúcho assumiu a liderança do vestiário. Com ele na beira do campo, são sete partidas com seis vitórias e um empate, sendo esse último que garantiu uma vaga na fase de grupos da Libertadores fora de casa com um jogador a menos.\n\nEm meio ao debate se Matias deve ou não ser efetivado no comando da equipe, o ge reuniu três argumentos pela permanência, e três contra e pede o seu voto sobre o tema. Confira:\n\nConhecimento do elenco\n\nFábio Matias chegou ao clube em janeiro. Por mais que não seja um período tão extenso de trabalho no Glorioso, ele já participou de toda a pré-temporada com o grupo, fez observações e conhece bem os jogadores que tem à disposição.\n\nO profissional que vier de fora, ainda que seja de um time do Brasil, terá que passar por esse processo de conhecer os jogadores em meio a partidas decisivas de Libertadores, Copa do Brasil e Brasileiro nos próximos meses.\n\nBoa fase']","Fábio Matias' interim role has contributed to the growth of the Botafogo team. Under his management, the team has remained undefeated with six victories and one draw in seven matches. Junior Santos, in particular, has been in excellent form, scoring 12 goals in the season, with eight of them coming during Matias' tenure. Additionally, important reinforcements such as Gregore and Damián Suárez have joined the team during this period.",0.999999999975,1.0,0.8815476074596992,0.75
9,How much has the Libertadores prize money increased in 2024 compared to the previous year?,"The Libertadores prize money for 2024 has increased by 5 million dollars compared to the previous year, with the champion receiving 23 million dollars. This represents a total of 115.2 million reais in the current exchange rate.","['Presidente da Conmebol anuncia aumento em prêmio da Libertadores 2024; veja valor\n\nBrasil será representado por sete equipes: Atlético-MG, Botafogo, Flamengo, Fluminense, Grêmio, Palmeiras e São Paulo\n\nPor Marcelo Braga — Luque, Paraguai\n\n18/03/2024 21h00    Atualizado há uma semana\n\nO presidente da Conmebol, Alejandro Domínguez, anunciou na noite desta segunda-feira, antes do sorteio dos grupos da Libertadores, que o campeão desta edição receberá 23 milhões de dólares (R$ 115,2 milhões na cotação atual). O valor representa um aumento de 5 milhões de dólares em relação ao que o Fluminense, atual campeão, levou em 2023.\n\n+ Veja como ficaram os grupos da Sul-Americana\n\nLive analisa sorteio da Libertadores e da Sul-Americana\n\nPremiação por fase:\n\nFase de grupos: 3 milhões de dólares (R$ 15 milhões)\n\nOitavas de final: 1,2 milhão de dólares (R$ 6 milhões)\n\nQuartas de final: 1,7 milhão de dólares (R$ 8,5 milhões)\n\nSemifinal: 2,3 milhões de dólares (R$ 11,5 milhões)'
 'Semifinal: 2,3 milhões de dólares (R$ 11,5 milhões)\n\nVice-campeão: 7 milhões de dólares (R$ 35 milhões)\n\nCampeão: 23 milhões de dólares (R$ 115,2 milhões)\n\nAlejandro Domínguez, presidente da Conmebol — Foto: Staff Image\n\nDatas\n\nA fase de grupos da Libertadores começa na primeira semana de abril, com jogos entre os dias 2 e 4. A última rodada será entre 28 a 30 de maio. A final da Copa Libertadores de 2024 será em Buenos Aires, na Argentina, mas o estádio ainda não foi divulgado. A partida está marcada para o dia 30 de novembro. Esse formato, da decisão em jogo único, começou em 2019.\n\nTaça da Libertadores 2024 — Foto: Jeferson Guareze/AGIF'
 '7/5 - 21h - Deportivo Táchira x Libertad\n\n14/5 - 21h - River Plate x Libertad\n\n15/5 - 19h - Deportivo Táchira x Nacional-URU\n\n30/5 - 21h - River Plate x Deportivo Táchira\n\n30/5 - 21h - Libertad x Nacional-URU\n\nConfira a análise do Grupo H da Conmebol Libertadores\n\nPremiação\n\nO campeão receberá até US$ 33,05 milhões (R$ 166,2 milhões), cinco milhões de dólares a mais que o vencedor da final da Libertadores do ano passado. A alteração foi no valor do campeão na final - de US$ 18 milhões passou para US$ 23 milhões.'
 'Tabela da Libertadores 2024: veja data e hora dos jogos dos brasileiros\n\nFase de grupos começa no dia 2 de abril e vai até 30 de maio\n\nPor Redação do ge — Luque, Paraguai\n\n19/03/2024 19h57    Atualizado há 6 dias\n\nA Conmebol divulgou nesta terça-feira a tabela da fase de grupos da Libertadores 2024. Após o sorteio realizado na segunda-feira, a entidade revelou as datas e as horas das partidas. Esta fase será disputada entre 2 de abril e 30 de maio. A final ocorrerá em Buenos Aires, no dia 30 de novembro..\n\n+ Libertadores 2024: veja análise dos grupos dos times brasileiros\n\nConfira como ficaram os grupos da Conmebol Libertadores 2024\n\n+ Veja a tabela completa atualizada\n\nVeja as datas e horários (de Brasília) dos jogos dos times brasileiros\n\nTaça da Libertadores: fase de grupos começa na próxima terça — Foto: Jeferson Guareze/AGIF\n\nGrupo A\n\n3/4 - 21h - Colo-Colo x Cerro Porteño\n\n3/4 - 21h30 - Alianza Lima x Fluminense\n\n9/4 - 21h - Fluminense x Colo-Colo']",The prize money for the Libertadores has increased by 5 million dollars in 2024 compared to the previous year.,0.8333333332916666,1.0,0.9423990187700492,1.0
